{
  "$schema": "http://json-schema.org/draft-07/schema#",
  "type": "object",
  "required": ["name", "displayName", "description", "author", "homepage"],
  "properties": {
    "name": {
      "type": "string",
      "pattern": "^[a-z0-9-]+$",
      "description": "Unique identifier for the server (lowercase, hyphens allowed)"
    },
    "displayName": {
      "type": "string",
      "description": "Human-readable name"
    },
    "description": {
      "type": "string",
      "description": "Short description of what the server does"
    },
    "author": {
      "type": "string",
      "description": "Author name or organization"
    },
    "homepage": {
      "type": "string",
      "format": "uri",
      "description": "URL to the server's homepage or documentation"
    },
    "repository": {
      "type": "string",
      "format": "uri",
      "description": "URL to the source code repository"
    },
    "license": {
      "type": "string",
      "description": "SPDX license identifier"
    },
    "categories": {
      "type": "array",
      "items": {
        "type": "string"
      },
      "description": "Categories for classification"
    },
    "tags": {
      "type": "array",
      "items": {
        "type": "string"
      },
      "description": "Tags for searchability"
    }
  }
}
